{
  "schema_version": "1.0.0",
  "name": "base",
  "description": "Small language-neutral development foundation",
  "extends": [],
  "include": ["realm-base", "common-cli"],
  "exclude": [],
  "platforms": ["linux/amd64", "linux/arm64"],
  "projections": ["docker", "devcontainer", "nix", "workstation"],
  "constraints": {"allow_privileged": false, "allow_services": false, "secrets": "forbidden"}
}
