{
  "schema_version": "1.0.0",
  "name": "flutter",
  "description": "Base environment plus the pinned Flutter SDK",
  "extends": ["base"],
  "include": ["flutter-toolchain"],
  "exclude": [],
  "platforms": ["linux/amd64", "linux/arm64"],
  "projections": ["docker", "devcontainer", "nix", "workstation"],
  "constraints": {"allow_privileged": false, "allow_services": false, "secrets": "forbidden"}
}
